title,company,employment_type,job_level,category,salary_lower,salary_upper,salary_time_interval,roles,requirements
"Manager, Data Science",LAZADA SOUTH EAST ASIA PTE. LTD.,Full Time,Manager,Information Technology,6000.0,9000.0,Monthly,"Team Introduction Lazada is the number one online shopping & selling destination in Southeast Asia – present in Indonesia, Malaysia, the Philippines, Singapore, Thailand and Vietnam. Lazada helps more than 80,000 local and international sellers as well as 2,500 brands serve the 560 million consumers in the region through its marketplace platform, supported by a wide range of tailored marketing, data, and service solutions. Lazada offers an excellent customer experience through a wide network of logistics partners and its own first- and last-mile delivery arm. Job Description As a Lazada data scientist, you will face different challenges. You will be applying different techniques such as deep learning, reinforcement learning, natural language processing and operational research to solve real world problems. You will be:  Responsible for recommendation frameworks and algorithms for products, product topics, sellers, and feeds stream by item quality control and online personalization. Responsible for developing audience, content and bidding algorithms for digital marketing on channels, and help engage our customers better by notifications. Responsible for campaign operation algorithms for seller and product recruiting, product scheduling, stock prediction, pricing strategy, and onsite recommendations. Responsible for ecommerce knowledge representations, quality controlling and caring for product, category, seller and reviews; natural language processing for opinion mining and text generation. ","Team Introduction Lazada is the number one online shopping & selling destination in Southeast Asia – present in Indonesia, Malaysia, the Philippines, Singapore, Thailand and Vietnam. Lazada helps more than 80,000 local and international sellers as well as 2,500 brands serve the 560 million consumers in the region through its marketplace platform, supported by a wide range of tailored marketing, data, and service solutions. Lazada offers an excellent customer experience through a wide network of logistics partners and its own first- and last-mile delivery arm. Job Description As a Lazada data scientist, you will face different challenges. You will be applying different techniques such as deep learning, reinforcement learning, natural language processing and operational research to solve real world problems. You will be:  Responsible for recommendation frameworks and algorithms for products, product topics, sellers, and feeds stream by item quality control and online personalization. Responsible for developing audience, content and bidding algorithms for digital marketing on channels, and help engage our customers better by notifications. Responsible for campaign operation algorithms for seller and product recruiting, product scheduling, stock prediction, pricing strategy, and onsite recommendations. Responsible for ecommerce knowledge representations, quality controlling and caring for product, category, seller and reviews; natural language processing for opinion mining and text generation. "
"Associate, Data Science",LAZADA SOUTH EAST ASIA PTE. LTD.,Permanent,Executive,Information Technology,4000.0,7000.0,Monthly,"Team Introduction Lazada is the number one online shopping & selling destination in Southeast Asia – present in Indonesia, Malaysia, the Philippines, Singapore, Thailand and Vietnam. Lazada helps more than 80,000 local and international sellers as well as 2,500 brands serve the 560 million consumers in the region through its marketplace platform, supported by a wide range of tailored marketing, data, and service solutions. Lazada offers an excellent customer experience through a wide network of logistics partners and its own first- and last-mile delivery arm. Responsibilities As a Lazada data scientist, you will face different challenges. You will be applying different techniques such as deep learning, reinforcement learning, natural language processing and operational research to solve real world problems. You will be:  Responsible for recommendation frameworks and algorithms for products, product topics, sellers, and feeds stream by item quality control and online personalization. Responsible for developing audience, content and bidding algorithms for digital marketing on channels, and help engage our customers better by notifications. Responsible for campaign operation algorithms for seller and product recruiting, product scheduling, stock prediction, pricing strategy, and onsite recommendations. Responsible for ecommerce knowledge representations, quality controlling and caring for product, category, seller and reviews; natural language processing for opinion mining and text generation. ","Team Introduction Lazada is the number one online shopping & selling destination in Southeast Asia – present in Indonesia, Malaysia, the Philippines, Singapore, Thailand and Vietnam. Lazada helps more than 80,000 local and international sellers as well as 2,500 brands serve the 560 million consumers in the region through its marketplace platform, supported by a wide range of tailored marketing, data, and service solutions. Lazada offers an excellent customer experience through a wide network of logistics partners and its own first- and last-mile delivery arm. Responsibilities As a Lazada data scientist, you will face different challenges. You will be applying different techniques such as deep learning, reinforcement learning, natural language processing and operational research to solve real world problems. You will be:  Responsible for recommendation frameworks and algorithms for products, product topics, sellers, and feeds stream by item quality control and online personalization. Responsible for developing audience, content and bidding algorithms for digital marketing on channels, and help engage our customers better by notifications. Responsible for campaign operation algorithms for seller and product recruiting, product scheduling, stock prediction, pricing strategy, and onsite recommendations. Responsible for ecommerce knowledge representations, quality controlling and caring for product, category, seller and reviews; natural language processing for opinion mining and text generation. "
Senior Data Scientist,Company Undisclosed,Full Time,Professional,Professional Services,,,,"Minimum of 4-5 years’ experience with the standard data science stack -- Python, Numpy, Pandas, Scikit-Learn, scipy, matplotlib, NLTK, etc.). * Familiarity with (some of) Keras, Tensorflow, Theano, R, C/C++, Java, Hadoop, or Spark a plus.  ","Minimum of 4-5 years’ experience with the standard data science stack -- Python, Numpy, Pandas, Scikit-Learn, scipy, matplotlib, NLTK, etc.). * Familiarity with (some of) Keras, Tensorflow, Theano, R, C/C++, Java, Hadoop, or Spark a plus.  "
Data Scientist,ABAKUS (ASIA PACIFIC) PTE. LTD.,Permanent,"Manager, Executive, Senior Executive","Banking and Finance, Information Technology",4000.0,8000.0,Monthly,"To reinvent an industry, you need to build an all-star team. Join Wecash if you want to leverage upon the power of big data and machine learning to design, develop, promote and operate technology and products that can provide better credit assessment of consumers and business owners to facilitate loans underwriting between institutional lenders and individuals. Founded in 2014, we are the first Chinese startup using big data and machine learning to evaluate consumer credit and detect fraud. Our company has raised more than US$260 million in equity financing over 4 rounds, acquired over 130 million users and have underwritten more than US$8 billion in loans to transform the lifestyle and credit worthiness of individuals around the world. Our team is over 800-strong across our offices in Greater China, North America, Latin America and Asia Pacific. We are constantly on the lookout for talent to join us on our journey to transform the consumer finance experience for consumers around the world, and invite you to start a conversation with us today. Wecash is looking for a stellar technologist to drive our expansion in Asia Pacific. If you can understand complex technology, navigate the fintech industry and thrive under ambiguous objectives, join us as our Data Scientist in Southeast Asia, and help us grow. Responsibilities  Adept in the art of cleansing, manipulation, feature extraction and analysis on large data sets Seek out external data sources for relevant context and combine external data with existing data to improve our credit and risk models Stay on top of latest developments in big data, data mining, natural language processing, machine learning and artificial intelligence techniques and technologies, while interpreting their impact and usefulness to the financial industry Design and implement machine learning-based credit and risk models and systems that can scale to serve and benefit tens of millions of customers Design elegant data visualizations to present complex analysis and insights to both internal (management) and external (customers) audiences Develop subsystems that facilitate performance tracking, analysis and ongoing optimization of implemented credit and risk models ","To reinvent an industry, you need to build an all-star team. Join Wecash if you want to leverage upon the power of big data and machine learning to design, develop, promote and operate technology and products that can provide better credit assessment of consumers and business owners to facilitate loans underwriting between institutional lenders and individuals. Founded in 2014, we are the first Chinese startup using big data and machine learning to evaluate consumer credit and detect fraud. Our company has raised more than US$260 million in equity financing over 4 rounds, acquired over 130 million users and have underwritten more than US$8 billion in loans to transform the lifestyle and credit worthiness of individuals around the world. Our team is over 800-strong across our offices in Greater China, North America, Latin America and Asia Pacific. We are constantly on the lookout for talent to join us on our journey to transform the consumer finance experience for consumers around the world, and invite you to start a conversation with us today. Wecash is looking for a stellar technologist to drive our expansion in Asia Pacific. If you can understand complex technology, navigate the fintech industry and thrive under ambiguous objectives, join us as our Data Scientist in Southeast Asia, and help us grow. Responsibilities  Adept in the art of cleansing, manipulation, feature extraction and analysis on large data sets Seek out external data sources for relevant context and combine external data with existing data to improve our credit and risk models Stay on top of latest developments in big data, data mining, natural language processing, machine learning and artificial intelligence techniques and technologies, while interpreting their impact and usefulness to the financial industry Design and implement machine learning-based credit and risk models and systems that can scale to serve and benefit tens of millions of customers Design elegant data visualizations to present complex analysis and insights to both internal (management) and external (customers) audiences Develop subsystems that facilitate performance tracking, analysis and ongoing optimization of implemented credit and risk models "
Data Scientist,DIMENSION DATA ASIA PACIFIC PTE. LTD.,Permanent,Executive,Information Technology,7000.0,8900.0,Monthly,"Dimension Data has a vast support service portfolio that contains thousands of contracts, millions of CI across a multitude of suppliers. Dimension Data is seeking to capitalising on these vast repositories of data using advance tools to visualise such information. The role of the CSM Group Systems Analyst is to ensure that all the Dimension Data Tier 1 systems and the associated underlying data is aligned to enable the CSM community to capitalise on any extracted information to drive renewal sales and cross functional programmes to enable client success. The individual will work as a part of an expanding group function, looking backwards into the business as well as third parties to establish the correct data linkages between the respective systems/tools to extract the maximum value. As a team member the individual should be conversant and fluent in data manipulation in many differing formats, passionate at combining data sets, extracting information and modelling using a variety of tools to ensure greater sales opportunities are extracted. We are also seeking an individual that is commercially aware; has the ability to link extracted data to solve business challenges, breaking down such challenges into discreate milestone opportunities. As a global role the individual is expected to be flexible in nature, adjusting their personal work patterns at time to align to the needs of a remote region. In this position the Group System Analyst will be required to: Own the linkage of data between systems ensuring data accuracy and completeness, aligned to the business time lines for data delivery Ensure data is manipulated, extracted and loaded in a timely fashion to support the business objectives Work with the respective regional data contacts to ensure accurate and timely collection and correction of any system data to ensure smooth operational effectiveness. Seek to streamline and automate as many data capture processes to enable the business to scale and grow effectively. Provide ideas, and guidance on how best to provide performance reports for the respective regions with focus on how contract growth is performing.","Dimension Data has a vast support service portfolio that contains thousands of contracts, millions of CI across a multitude of suppliers. Dimension Data is seeking to capitalising on these vast repositories of data using advance tools to visualise such information. The role of the CSM Group Systems Analyst is to ensure that all the Dimension Data Tier 1 systems and the associated underlying data is aligned to enable the CSM community to capitalise on any extracted information to drive renewal sales and cross functional programmes to enable client success. The individual will work as a part of an expanding group function, looking backwards into the business as well as third parties to establish the correct data linkages between the respective systems/tools to extract the maximum value. As a team member the individual should be conversant and fluent in data manipulation in many differing formats, passionate at combining data sets, extracting information and modelling using a variety of tools to ensure greater sales opportunities are extracted. We are also seeking an individual that is commercially aware; has the ability to link extracted data to solve business challenges, breaking down such challenges into discreate milestone opportunities. As a global role the individual is expected to be flexible in nature, adjusting their personal work patterns at time to align to the needs of a remote region. In this position the Group System Analyst will be required to: Own the linkage of data between systems ensuring data accuracy and completeness, aligned to the business time lines for data delivery Ensure data is manipulated, extracted and loaded in a timely fashion to support the business objectives Work with the respective regional data contacts to ensure accurate and timely collection and correction of any system data to ensure smooth operational effectiveness. Seek to streamline and automate as many data capture processes to enable the business to scale and grow effectively. Provide ideas, and guidance on how best to provide performance reports for the respective regions with focus on how contract growth is performing."
Hiring Senior Data Scientist. Direct Applicants only,ISMART SYNERGY PTE. LTD.,"Permanent, Contract, Full Time","Senior Management, Professional",Information Technology,,,,"To succeed in this role the candidate must possess the ability to deal with complex data integration issues, evaluate different algorithmic approaches and analyse Data to solve problems. Will provide Technical Leadership and report to the C-Suite. Key Responsibilities:   PreSales : Build Relationships with Stakeholders and turn from a Concepts/Ideas into compelling proposals that engage stakeholders and clients. Partner closely with the Business Development and Sales teams, to enable large-scale customer use cases and drive the adoption of our Solutions. Analyse and build prototypes for POC stage using data science techniques Work with our partners to deliver Data and Tools needed for POCs Identify, clean and wrangle data. Integrate internal and external data sources using APIs  Develop test Algorithms with tools and languages like R, Python, etc.      ","To succeed in this role the candidate must possess the ability to deal with complex data integration issues, evaluate different algorithmic approaches and analyse Data to solve problems. Will provide Technical Leadership and report to the C-Suite. Key Responsibilities:   PreSales : Build Relationships with Stakeholders and turn from a Concepts/Ideas into compelling proposals that engage stakeholders and clients. Partner closely with the Business Development and Sales teams, to enable large-scale customer use cases and drive the adoption of our Solutions. Analyse and build prototypes for POC stage using data science techniques Work with our partners to deliver Data and Tools needed for POCs Identify, clean and wrangle data. Integrate internal and external data sources using APIs  Develop test Algorithms with tools and languages like R, Python, etc.      "
"Data Analyst / Scientist (Tableau, SQL,Excel and VBA macro)",OPTIMUM SOLUTIONS (SINGAPORE) PTE LTD,Contract,"Senior Management, Manager",Information Technology,5000.0,9000.0,Monthly,"Optimum Solutions (Company Registration Number: 199700895N), is a full spectrum Software Solutions and Services Company. Software services from Optimum are designed to deliver Enterprise Client-Server/ Multi-tier and Web based solutions across the entire value chain, spanning on-site consulting services to turnkey software projects. We started our operations in March 1997. Role- Data Analyst/Scientist (Tableau, SQL,Excel and VBA macro)","Optimum Solutions (Company Registration Number: 199700895N), is a full spectrum Software Solutions and Services Company. Software services from Optimum are designed to deliver Enterprise Client-Server/ Multi-tier and Web based solutions across the entire value chain, spanning on-site consulting services to turnkey software projects. We started our operations in March 1997. Role- Data Analyst/Scientist (Tableau, SQL,Excel and VBA macro)"
Senior Data Scientist (Smallholder Digital Lab),YARA ASIA PTE. LTD.,Permanent,Professional,Information Technology,9000.0,13000.0,Monthly,"There are more than 500 million smallholder farms globally with at least 2 billion people depending on them for their livelihoods. In many of these segments, agricultural productivity is up to 10 times less than in developed markets.  The smallholder focused solutions teams have the challenge to develop digital solutions with the focus on increasing productivity through optimal crop nutrition and knowledge transfer. About the Unit Digital Farming is a newly established global unit, created in Yara Crop Nutrition. With locations in Europe, Brazil, Singapore and North America we are shaping the future of farming by building new digital business models. We identify new digital products, enhance customer interaction and achieve digitally enabled functional excellence. Our aspiration is to shape Yara as the digital leader in crop nutrition.  We build solutions for farmers, construct hardware and sensors, crunch satellite data, apply artificial intelligence, and turn research results into solutions. Our team is made of designers, software engineers, hardware developers, data scientists, solution managers and product owners. Responsibilities  Study, develop and manage the data resources of the analytics and insights side of the smallholder solutions. Research new ways to interpret and utilise the data resources to provide meaningful, actionable insights. Work cross-functionally with different parts of the development centre to support the data needs of different teams. Develop, test and implement various scripts, algorithms and code when necessary.  Additional information We encourage all qualified applicants from all background to apply and are committed to creating a work environment that fits gender equality and allows combining career progress with the needs of a family or other personal circumstances. Why us?  Well funded, supported and staffed corporate innovation hub which offers a balance between startup culture and corporate support and benefits  Direct impact on products, which provide real value to farmers Work on sustainable solutions that benefit mankind and the environment Unlimited working contract and competitive remuneration + benefits Support for personal development, training and continuous learning Commitment to using new technologies and frameworks, in-house hackathons, meetups, and knowledge sharing ","There are more than 500 million smallholder farms globally with at least 2 billion people depending on them for their livelihoods. In many of these segments, agricultural productivity is up to 10 times less than in developed markets.  The smallholder focused solutions teams have the challenge to develop digital solutions with the focus on increasing productivity through optimal crop nutrition and knowledge transfer. About the Unit Digital Farming is a newly established global unit, created in Yara Crop Nutrition. With locations in Europe, Brazil, Singapore and North America we are shaping the future of farming by building new digital business models. We identify new digital products, enhance customer interaction and achieve digitally enabled functional excellence. Our aspiration is to shape Yara as the digital leader in crop nutrition.  We build solutions for farmers, construct hardware and sensors, crunch satellite data, apply artificial intelligence, and turn research results into solutions. Our team is made of designers, software engineers, hardware developers, data scientists, solution managers and product owners. Responsibilities  Study, develop and manage the data resources of the analytics and insights side of the smallholder solutions. Research new ways to interpret and utilise the data resources to provide meaningful, actionable insights. Work cross-functionally with different parts of the development centre to support the data needs of different teams. Develop, test and implement various scripts, algorithms and code when necessary.  Additional information We encourage all qualified applicants from all background to apply and are committed to creating a work environment that fits gender equality and allows combining career progress with the needs of a family or other personal circumstances. Why us?  Well funded, supported and staffed corporate innovation hub which offers a balance between startup culture and corporate support and benefits  Direct impact on products, which provide real value to farmers Work on sustainable solutions that benefit mankind and the environment Unlimited working contract and competitive remuneration + benefits Support for personal development, training and continuous learning Commitment to using new technologies and frameworks, in-house hackathons, meetups, and knowledge sharing "
