title,company,employment_type,job_level,category,salary_lower,salary_upper,salary_time_interval,roles,requirements
Data Engineer,GOVERNMENT TECHNOLOGY AGENCY,Permanent,,"Information Technology, Public / Civil Service",,,,"The Government Digital Services team is seeking an accomplished Data Engineer. We are a team in GovTech that aims to design and develop software applications that help government agencies to better serve the needs of Singaporeans. We adopt an Agile development approach and work towards adopting tech best practices and cutting edge tools.
We are looking for a savvy Data Engineer to join our growing team of analytics experts. The hire will be responsible for expanding and optimizing our data and data pipeline architecture, as well as optimizing data flow and collection for cross functional teams. The ideal candidate is an experienced data pipeline builder and data wrangler who enjoys optimizing data systems and building them from the ground up.
The Data Engineer will support our software developers, database architects, data analysts and data scientists on data initiatives and will ensure optimal data delivery architecture is consistent throughout ongoing projects. They must be self-directed and comfortable supporting the data needs of multiple teams, systems and products. The right candidate will be excited by the prospect of optimizing or even re-designing our company’s data architecture to support our next generation of products and data initiatives.
What To Expect:

Create and maintain optimal data pipeline architecture.
Assemble large, complex data sets that meet functional / non-functional business requirements.
Identify, design, and implement internal process improvements: automating manual processes, optimizing data delivery, re-designing infrastructure for greater scalability, etc.
Build the infrastructure required for optimal extraction, transformation, and loading of data from a wide variety of data sources using SQL and ‘big data’ technologies.
Build analytics tools that utilize the data pipeline to provide actionable insights into customer acquisition, operational efficiency and other key business performance metrics.
Work with stakeholders including the Executive, Product, Data and Design teams to assist with data-related technical issues and support their data infrastructure needs.
Keep our data separated and secure through multiple data centers.
Create data tools for analytics and data scientist team members that assist them in building and optimizing our product into an innovative industry leader.
Work with data and analytics experts to strive for greater functionality in our data systems.

How To Succeed:

Advanced working SQL knowledge and experience working with relational databases, query authoring (SQL) as well as working familiarity with a variety of databases.
Experience building and optimizing ‘big data’ data pipelines, architectures and data sets.
Experience performing root cause analysis on internal and external data and processes to answer specific business questions and identify opportunities for improvement.
Strong analytic skills related to working with unstructured datasets.
Build processes supporting data transformation, data structures, metadata, dependency and workload management.
A successful history of manipulating, processing and extracting value from large disconnected datasets.
Working knowledge of message queuing, stream processing, and highly scalable ‘big data’ data stores.
Experience supporting and working with cross-functional teams in a dynamic environment.
We are looking for a candidate with 5+ years of experience in a Data Engineer role, who has attained a Graduate degree in Computer Science, Statistics, Informatics, Information Systems or another quantitative field. Preferably with the experience of using the following software/tools:

Experience with big data tools: Hadoop, Spark, Kafka, RabbitMQ etc.
Experience with relational SQL and NoSQL databases, including Postgres and Cassandra.
Experience with data pipeline and workflow management tools: Azkaban, Luigi, Airflow, etc.
Experience with AWS cloud services: EC2, EMR, RDS, Redshift
Experience with stream-processing systems: Storm, Spark-Streaming, etc.
Experience with either of these languages: Python, Java.


",
"VP  /  AVP, Data Science Analyst (Customer Science), Regional Consumer Banking Ops, T&O (18000449)",DBS BANK LTD.,"Permanent, Full Time","Middle Management, Manager",Banking and Finance,9500.0,15000.0,Monthly," Development and solutioning of real time predictive analytics to derive actionable insights to intervene positively into the customer’s digital journey Perform full life-cycle of Data Scientist / Analyst activities, including conceptualization to operationalization  Primary focus will be in applying data science to solve business problems; doing statistical analysis, building high-quality prediction systems, and use deep learning techniques Able to understand and solve the business problem by translating into a data model and building insights into an actionable outcome  Collaborate with cross-functional business teams to deliver high-impact insights using analytics across a variety of customer servicing areas Research, design, implement and validate models / algorithms to analyse diverse sources of data to achieve targeted outcomes  Carry out customer behaviour analytics and deliver actionable insights in real time; through behaviour segmentation, predictive modelling, lifetime value modelling, churn prevention, statistical simulations and what if scenarios Stay on top of current industry trends on machine learning/AI "," Development and solutioning of real time predictive analytics to derive actionable insights to intervene positively into the customer’s digital journey Perform full life-cycle of Data Scientist / Analyst activities, including conceptualization to operationalization  Primary focus will be in applying data science to solve business problems; doing statistical analysis, building high-quality prediction systems, and use deep learning techniques Able to understand and solve the business problem by translating into a data model and building insights into an actionable outcome  Collaborate with cross-functional business teams to deliver high-impact insights using analytics across a variety of customer servicing areas Research, design, implement and validate models / algorithms to analyse diverse sources of data to achieve targeted outcomes  Carry out customer behaviour analytics and deliver actionable insights in real time; through behaviour segmentation, predictive modelling, lifetime value modelling, churn prevention, statistical simulations and what if scenarios Stay on top of current industry trends on machine learning/AI "
"VP  /  AVP, Data Science Analyst (Customer Science), Regional Consumer Banking Ops, T&O (18000449)",DBS BANK LTD.,"Permanent, Full Time","Middle Management, Manager",Banking and Finance,6500.0,13000.0,Monthly," Development and solutioning of real time predictive analytics to derive actionable insights to intervene positively into the customer’s digital journey Perform full life-cycle of Data Scientist / Analyst activities, including conceptualization to operationalization  Primary focus will be in applying data science to solve business problems; doing statistical analysis, building high-quality prediction systems, and use deep learning techniques Able to understand and solve the business problem by translating into a data model and building insights into an actionable outcome  Collaborate with cross-functional business teams to deliver high-impact insights using analytics across a variety of customer servicing areas Research, design, implement and validate models / algorithms to analyse diverse sources of data to achieve targeted outcomes  Carry out customer behaviour analytics and deliver actionable insights in real time; through behaviour segmentation, predictive modelling, lifetime value modelling, churn prevention, statistical simulations and what if scenarios Stay on top of current industry trends on machine learning/AI "," Development and solutioning of real time predictive analytics to derive actionable insights to intervene positively into the customer’s digital journey Perform full life-cycle of Data Scientist / Analyst activities, including conceptualization to operationalization  Primary focus will be in applying data science to solve business problems; doing statistical analysis, building high-quality prediction systems, and use deep learning techniques Able to understand and solve the business problem by translating into a data model and building insights into an actionable outcome  Collaborate with cross-functional business teams to deliver high-impact insights using analytics across a variety of customer servicing areas Research, design, implement and validate models / algorithms to analyse diverse sources of data to achieve targeted outcomes  Carry out customer behaviour analytics and deliver actionable insights in real time; through behaviour segmentation, predictive modelling, lifetime value modelling, churn prevention, statistical simulations and what if scenarios Stay on top of current industry trends on machine learning/AI "
Data Scientist,MSD INTERNATIONAL GMBH (SINGAPORE BRANCH),"Permanent, Full Time",Executive,Information Technology,4000.0,7000.0,Monthly,"The Global Data Science Competency (GDSC) comprises approximately 90 diverse and high performing data science professionals located in three IT hubs in the United States, Prague, and Singapore. The GDSC brings advanced methods such as machine learning, statistical modelling, optimisation, mathematical modelling, and data mining to the company both through consulting style projects and data product development. The GDSC is a rapidly evolving organisation specialising in applying data science across the company, with its current footprint ranging across domains such as Real-World Evidence, Manufacturing, Human Resources, Information Technology, Compliance, Market Research and Commercial. Global Data Science Competency values are curiosity, quality, and collaboration The AI and Data Products team takes a product view on AI and automation technologies such as machine learning, NLP, machine vision and RPA. The team builds and deploys models and intelligent agents across the enterprise. Job description:  The Data Scientist leverages a deep understanding of structured and unstructured data processing, analytics techniques, machine learning model development and software development to develop rapid prototypes of potential AI products for internals customers. The team works closely with complementary IT teams to develop, deploy, launch and improve data products at scale in production systems. Occasionally the data scientist would also take part in ad-hoc consulting or data mining projects. The data science team participates in all project phases including ideation, business case development, project definition, data discovery and preparation, model development and/or data mining, product prototyping and assisting adoption. They may also be involved in product deployment through an SDLC process   Tasks:  Participate in stakeholder meetings to understand business problems and translate them into products aligned with company needs and strategies Prototyping of software products in a DevOps environment Includes automation of data pipelines and deploying statistical and machine learning models into production More senior members will be expected to either lead engagement with business units, or act as SMEs for one or more AI domains (machine vision, NLP etc.) ","The Global Data Science Competency (GDSC) comprises approximately 90 diverse and high performing data science professionals located in three IT hubs in the United States, Prague, and Singapore. The GDSC brings advanced methods such as machine learning, statistical modelling, optimisation, mathematical modelling, and data mining to the company both through consulting style projects and data product development. The GDSC is a rapidly evolving organisation specialising in applying data science across the company, with its current footprint ranging across domains such as Real-World Evidence, Manufacturing, Human Resources, Information Technology, Compliance, Market Research and Commercial. Global Data Science Competency values are curiosity, quality, and collaboration The AI and Data Products team takes a product view on AI and automation technologies such as machine learning, NLP, machine vision and RPA. The team builds and deploys models and intelligent agents across the enterprise. Job description:  The Data Scientist leverages a deep understanding of structured and unstructured data processing, analytics techniques, machine learning model development and software development to develop rapid prototypes of potential AI products for internals customers. The team works closely with complementary IT teams to develop, deploy, launch and improve data products at scale in production systems. Occasionally the data scientist would also take part in ad-hoc consulting or data mining projects. The data science team participates in all project phases including ideation, business case development, project definition, data discovery and preparation, model development and/or data mining, product prototyping and assisting adoption. They may also be involved in product deployment through an SDLC process   Tasks:  Participate in stakeholder meetings to understand business problems and translate them into products aligned with company needs and strategies Prototyping of software products in a DevOps environment Includes automation of data pipelines and deploying statistical and machine learning models into production More senior members will be expected to either lead engagement with business units, or act as SMEs for one or more AI domains (machine vision, NLP etc.) "
Data Scientist,Company Undisclosed,"Contract, Full Time",Professional,Healthcare / Pharmaceutical,5000.0,8000.0,Monthly,"The Data Scientist will be responsible for designing and implementing algorithms using predictive / analytical modelling, systematic data mining methodology, and research methodology on large and complex data sets, through statistical, machine learning, graph modelling, text mining and other modern techniques. This individual will be closely working with APAC Supply Chain Planning COE (Centre of Expertise) to define specific data points required to develop Business Intelligence and Advance Analytics solutions to support APAC Supply Chain from an Order to Cash, Inventory, Working capital perspective and other areas as assigned.  POSITION RESPONSIBILITIES:  Knowledge and experience in researching and developing models and algorithms that can detect patterns in multi-dimensional data and build predictive models based on such data. Knowledge and experience in machine learning and statistics to solve practical problems. Specifically, the knowledge includes classifications, clustering, time-series analysis, regression, and anomaly detection Perform the role as the lead Data Visualization and Business Intelligence expert and evangelist Implement analytical self-service environments and promote a culture of self-service analytics using data visualization tools like Tableau Produce visually intuitive and appealing ‘story boards’ using data visualization tools; Leverage Data Visualization techniques and tools to effectively demonstrate patterns, outliers and exceptional conditions in the data Work collaboratively with data analyst and users to implement BI solutions Keep abreast of developments and trends in Data Visualization and Business Intelligence space Translate complex data science and analytics concepts and methodology into business terms to the customer. Leverage Applied Analytics to develop relevant, data science and analytics solutions cost-effectively Understand complex business challenges, develop hypotheses, integrate internal and external data sources, analyse them using cutting edge machine learning and statistical modelling techniques to uncover causality and synthesizing insights Work closely with consultants to identify patterns in data, understand leading indicators and lagging indicators and present proof of hypotheses Mentor team members on testing techniques, model development and data science concepts Analyse data using SQL, Excel, Tableau, R, Python or other Business Intelligence tools Display analysis results using reports or visualizations Support Predictive Modelling projects with data preparation, exploration and other data and I.T. support ","The Data Scientist will be responsible for designing and implementing algorithms using predictive / analytical modelling, systematic data mining methodology, and research methodology on large and complex data sets, through statistical, machine learning, graph modelling, text mining and other modern techniques. This individual will be closely working with APAC Supply Chain Planning COE (Centre of Expertise) to define specific data points required to develop Business Intelligence and Advance Analytics solutions to support APAC Supply Chain from an Order to Cash, Inventory, Working capital perspective and other areas as assigned.  POSITION RESPONSIBILITIES:  Knowledge and experience in researching and developing models and algorithms that can detect patterns in multi-dimensional data and build predictive models based on such data. Knowledge and experience in machine learning and statistics to solve practical problems. Specifically, the knowledge includes classifications, clustering, time-series analysis, regression, and anomaly detection Perform the role as the lead Data Visualization and Business Intelligence expert and evangelist Implement analytical self-service environments and promote a culture of self-service analytics using data visualization tools like Tableau Produce visually intuitive and appealing ‘story boards’ using data visualization tools; Leverage Data Visualization techniques and tools to effectively demonstrate patterns, outliers and exceptional conditions in the data Work collaboratively with data analyst and users to implement BI solutions Keep abreast of developments and trends in Data Visualization and Business Intelligence space Translate complex data science and analytics concepts and methodology into business terms to the customer. Leverage Applied Analytics to develop relevant, data science and analytics solutions cost-effectively Understand complex business challenges, develop hypotheses, integrate internal and external data sources, analyse them using cutting edge machine learning and statistical modelling techniques to uncover causality and synthesizing insights Work closely with consultants to identify patterns in data, understand leading indicators and lagging indicators and present proof of hypotheses Mentor team members on testing techniques, model development and data science concepts Analyse data using SQL, Excel, Tableau, R, Python or other Business Intelligence tools Display analysis results using reports or visualizations Support Predictive Modelling projects with data preparation, exploration and other data and I.T. support "
Data Scientist,Company Undisclosed,"Contract, Full Time",Professional,Healthcare / Pharmaceutical,6000.0,9000.0,Monthly,"The Data Scientist will be responsible for designing and implementing algorithms using predictive / analytical modelling, systematic data mining methodology, and research methodology on large and complex data sets, through statistical, machine learning, graph modelling, text mining and other modern techniques. This individual will be closely working with APAC Supply Chain Planning COE (Centre of Expertise) to define specific data points required to develop Business Intelligence and Advance Analytics solutions to support APAC Supply Chain from an Order to Cash, Inventory, Working capital perspective and other areas as assigned.  POSITION RESPONSIBILITIES:  Knowledge and experience in researching and developing models and algorithms that can detect patterns in multi-dimensional data and build predictive models based on such data. Knowledge and experience in machine learning and statistics to solve practical problems. Specifically, the knowledge includes classifications, clustering, time-series analysis, regression, and anomaly detection Perform the role as the lead Data Visualization and Business Intelligence expert and evangelist Implement analytical self-service environments and promote a culture of self-service analytics using data visualization tools like Tableau Produce visually intuitive and appealing ‘story boards’ using data visualization tools; Leverage Data Visualization techniques and tools to effectively demonstrate patterns, outliers and exceptional conditions in the data Work collaboratively with data analyst and users to implement BI solutions Keep abreast of developments and trends in Data Visualization and Business Intelligence space Translate complex data science and analytics concepts and methodology into business terms to the customer. Leverage Applied Analytics to develop relevant, data science and analytics solutions cost-effectively Understand complex business challenges, develop hypotheses, integrate internal and external data sources, analyse them using cutting edge machine learning and statistical modelling techniques to uncover causality and synthesizing insights Work closely with consultants to identify patterns in data, understand leading indicators and lagging indicators and present proof of hypotheses Mentor team members on testing techniques, model development and data science concepts Analyse data using SQL, Excel, Tableau, R, Python or other Business Intelligence tools Display analysis results using reports or visualizations Support Predictive Modelling projects with data preparation, exploration and other data and I.T. support ","The Data Scientist will be responsible for designing and implementing algorithms using predictive / analytical modelling, systematic data mining methodology, and research methodology on large and complex data sets, through statistical, machine learning, graph modelling, text mining and other modern techniques. This individual will be closely working with APAC Supply Chain Planning COE (Centre of Expertise) to define specific data points required to develop Business Intelligence and Advance Analytics solutions to support APAC Supply Chain from an Order to Cash, Inventory, Working capital perspective and other areas as assigned.  POSITION RESPONSIBILITIES:  Knowledge and experience in researching and developing models and algorithms that can detect patterns in multi-dimensional data and build predictive models based on such data. Knowledge and experience in machine learning and statistics to solve practical problems. Specifically, the knowledge includes classifications, clustering, time-series analysis, regression, and anomaly detection Perform the role as the lead Data Visualization and Business Intelligence expert and evangelist Implement analytical self-service environments and promote a culture of self-service analytics using data visualization tools like Tableau Produce visually intuitive and appealing ‘story boards’ using data visualization tools; Leverage Data Visualization techniques and tools to effectively demonstrate patterns, outliers and exceptional conditions in the data Work collaboratively with data analyst and users to implement BI solutions Keep abreast of developments and trends in Data Visualization and Business Intelligence space Translate complex data science and analytics concepts and methodology into business terms to the customer. Leverage Applied Analytics to develop relevant, data science and analytics solutions cost-effectively Understand complex business challenges, develop hypotheses, integrate internal and external data sources, analyse them using cutting edge machine learning and statistical modelling techniques to uncover causality and synthesizing insights Work closely with consultants to identify patterns in data, understand leading indicators and lagging indicators and present proof of hypotheses Mentor team members on testing techniques, model development and data science concepts Analyse data using SQL, Excel, Tableau, R, Python or other Business Intelligence tools Display analysis results using reports or visualizations Support Predictive Modelling projects with data preparation, exploration and other data and I.T. support "
