title,company,employment_type,job_level,category,salary_lower,salary_upper,salary_time_interval,roles,requirements
Mid Level Data Scientist,TRAVELOKA SERVICES PTE. LTD.,Permanent,Executive,Information Technology,4300.0,7600.0,Monthly,"As a Data scientist, you will be applying machine learning techniques such as deep learning, reinforced learning, decision tree learning and other techniques to solve complex problems and drive insights from our sea of data. You will be responsible for:  Analyzing large, complex datasets into actionable insights Use data to solve complex problems which are pivotal to our business Effectively conceptualize analysis to internal stakeholders Conduct advanced statistical analysis Develop practical algorithms and frameworks to optimize Traveloka’s capabilities  Working in Traveloka:  You will work in cross-functional teams and meet great people regularly from top tier technology, consulting, product, or academic background.  We work in open environment where there are no boundaries or power distance.  Everyone is encouraged to speak their mind, propose ideas, influence others, and continuously grow themselves.  Get the exposure to multi-aspect, collaborative, intensive startup experience with our recent expansion into Southeast Asia and exploration of new products.    ","As a Data scientist, you will be applying machine learning techniques such as deep learning, reinforced learning, decision tree learning and other techniques to solve complex problems and drive insights from our sea of data. You will be responsible for:  Analyzing large, complex datasets into actionable insights Use data to solve complex problems which are pivotal to our business Effectively conceptualize analysis to internal stakeholders Conduct advanced statistical analysis Develop practical algorithms and frameworks to optimize Traveloka’s capabilities  Working in Traveloka:  You will work in cross-functional teams and meet great people regularly from top tier technology, consulting, product, or academic background.  We work in open environment where there are no boundaries or power distance.  Everyone is encouraged to speak their mind, propose ideas, influence others, and continuously grow themselves.  Get the exposure to multi-aspect, collaborative, intensive startup experience with our recent expansion into Southeast Asia and exploration of new products.    "
Junior - Mid Level Data Scientist,TRAVELOKA SERVICES PTE. LTD.,Permanent,Fresh/entry level,Information Technology,3000.0,6000.0,Monthly,"As a Data scientist, you will be applying machine learning techniques such as deep learning, reinforced learning, decision tree learning and other techniques to solve complex problems and drive insights from our sea of data. You will be responsible for:  Analyzing large, complex datasets into actionable insights Use data to solve complex problems which are pivotal to our business Effectively conceptualize analysis to internal stakeholders Conduct advanced statistical analysis Develop practical algorithms and frameworks to optimize Traveloka’s capabilities  Working in Traveloka:  You will work in cross-functional teams and meet great people regularly from top tier technology, consulting, product, or academic background.  We work in open environment where there are no boundaries or power distance.  Everyone is encouraged to speak their mind, propose ideas, influence others, and continuously grow themselves.  Get the exposure to multi-aspect, collaborative, intensive startup experience with our recent expansion into Southeast Asia and exploration of new products.    ","As a Data scientist, you will be applying machine learning techniques such as deep learning, reinforced learning, decision tree learning and other techniques to solve complex problems and drive insights from our sea of data. You will be responsible for:  Analyzing large, complex datasets into actionable insights Use data to solve complex problems which are pivotal to our business Effectively conceptualize analysis to internal stakeholders Conduct advanced statistical analysis Develop practical algorithms and frameworks to optimize Traveloka’s capabilities  Working in Traveloka:  You will work in cross-functional teams and meet great people regularly from top tier technology, consulting, product, or academic background.  We work in open environment where there are no boundaries or power distance.  Everyone is encouraged to speak their mind, propose ideas, influence others, and continuously grow themselves.  Get the exposure to multi-aspect, collaborative, intensive startup experience with our recent expansion into Southeast Asia and exploration of new products.    "
Senior Data Scientist,EXPERIAN SINGAPORE PTE. LTD.,Full Time,Junior Executive,Information Technology,100000.0,130000.0,Annually,"Role:  Data scientist with hands on expertise in building and executing analytics modules on various technology platforms including big data technology platforms. Successful candidates are intellectually curious builders who are biased toward action, scrappy, and communicative. Own and complete work streams for execution and delivery. Be able to compile results from various work streams and be able to make coherent presentations to internal and external stakeholders. Experience in building or managing data products, high performer and problem solver. Applying best practices to manage solution implementations including code design and reviews   ","Role:  Data scientist with hands on expertise in building and executing analytics modules on various technology platforms including big data technology platforms. Successful candidates are intellectually curious builders who are biased toward action, scrappy, and communicative. Own and complete work streams for execution and delivery. Be able to compile results from various work streams and be able to make coherent presentations to internal and external stakeholders. Experience in building or managing data products, high performer and problem solver. Applying best practices to manage solution implementations including code design and reviews   "
Senior Data Scientist,EXPERIAN SINGAPORE PTE. LTD.,Full Time,Junior Executive,Information Technology,130000.0,160000.0,Annually,"Role:  Data scientist with hands on expertise in building and executing analytics modules on various technology platforms including big data technology platforms. Successful candidates are intellectually curious builders who are biased toward action, scrappy, and communicative. Own and complete work streams for execution and delivery. Be able to compile results from various work streams and be able to make coherent presentations to internal and external stakeholders. Experience in building or managing data products, high performer and problem solver. Applying best practices to manage solution implementations including code design and reviews   ","Role:  Data scientist with hands on expertise in building and executing analytics modules on various technology platforms including big data technology platforms. Successful candidates are intellectually curious builders who are biased toward action, scrappy, and communicative. Own and complete work streams for execution and delivery. Be able to compile results from various work streams and be able to make coherent presentations to internal and external stakeholders. Experience in building or managing data products, high performer and problem solver. Applying best practices to manage solution implementations including code design and reviews   "
"Data Science manager, Global Lifecycle Analytics",PAYPAL PTE. LTD.,Permanent,Professional,Others,7750.0,11667.0,Monthly,"PayPal is seeking a business-savvy and action-oriented Data Scientist to join its Marketing Analytics team as Data Science Manager for Customer Lifecycle analytics. In this role, you will be responsible for leading data science activities to increase the adoption and conversation of marketing effort through the customer lifecycle across consumer and merchant segments. Your core responsibility will be to lead, support, and provide recommendations across some of the most challenging data scientists projects such as the development of incremental response marketing models. You will collaborate with the customer lifecycle business and analytics teams and be the single point of contact towards all data scientist related activities for customer lifecycle. This rare opportunity for a stellar data science professional involves creative freedom in generating global models to solve variate marketing problems and influence the organization on data models adoption to improve business performance. This highly visible role will make a significant contribution to the growth of our global business. What you will do:  Design, optimize, support new and existing data models for customer lifecycle with focus on uplift/incremental response models. Data discovery activities across new topics of analyze Drive the adoption of real-time ML models Use cutting-edge analytics and solid business judgment to identify, prioritize, structure and solve complex business problems Perform deep-dive descriptive and predictive analysis on very large, complex, multi-dimensional datasets Present recommendations to senior-level executives and measure effectiveness of recommendations by monitoring their impact ","PayPal is seeking a business-savvy and action-oriented Data Scientist to join its Marketing Analytics team as Data Science Manager for Customer Lifecycle analytics. In this role, you will be responsible for leading data science activities to increase the adoption and conversation of marketing effort through the customer lifecycle across consumer and merchant segments. Your core responsibility will be to lead, support, and provide recommendations across some of the most challenging data scientists projects such as the development of incremental response marketing models. You will collaborate with the customer lifecycle business and analytics teams and be the single point of contact towards all data scientist related activities for customer lifecycle. This rare opportunity for a stellar data science professional involves creative freedom in generating global models to solve variate marketing problems and influence the organization on data models adoption to improve business performance. This highly visible role will make a significant contribution to the growth of our global business. What you will do:  Design, optimize, support new and existing data models for customer lifecycle with focus on uplift/incremental response models. Data discovery activities across new topics of analyze Drive the adoption of real-time ML models Use cutting-edge analytics and solid business judgment to identify, prioritize, structure and solve complex business problems Perform deep-dive descriptive and predictive analysis on very large, complex, multi-dimensional datasets Present recommendations to senior-level executives and measure effectiveness of recommendations by monitoring their impact "
Data Scientist,EYEOTA PTE. LTD.,Full Time,"Manager, Professional",Information Technology,8000.0,16000.0,Monthly,"Eyeota is looking for an exceptional Data Scientist who can contribute to building a world class  Machine Learning product pipeline based on our petabyte-scale data platform. This person will be involved in:  Initial data mining and research, especially on up and coming technologies and algorithms Model prototyping (Feature engineering, Parameter Tuning, Hyper Parameter Tuning) Model development Partnering with Data Engineers and Dev Ops for Model deployment into production environment Ongoing monitoring of system performance Exploratory research to identify new avenues to monetise existing products  The candidate should have significant experience developing and operating a modern data pipeline platform and should have a keen interest in Machine Learning and Data Science.","Eyeota is looking for an exceptional Data Scientist who can contribute to building a world class  Machine Learning product pipeline based on our petabyte-scale data platform. This person will be involved in:  Initial data mining and research, especially on up and coming technologies and algorithms Model prototyping (Feature engineering, Parameter Tuning, Hyper Parameter Tuning) Model development Partnering with Data Engineers and Dev Ops for Model deployment into production environment Ongoing monitoring of system performance Exploratory research to identify new avenues to monetise existing products  The candidate should have significant experience developing and operating a modern data pipeline platform and should have a keen interest in Machine Learning and Data Science."
Data Scientist,NIOMETRICS (PTE.) LTD.,Permanent,Professional,Information Technology,5000.0,10000.0,Monthly,"WHAT WE DO Niometrics captures, organises and extracts insights from some of the biggest and most complicated datasets that our modern societies currently produce. We put a magnifying glass on the realities collectively constructed by billions of connected individuals and machines, making sense of how humanity is re-creating wholly new digital universes with bits and bytes – universes that need to be seen, interpreted and explained. From taking deep dives into digital behaviours, to exploring the most intimate interactions between network technology and user experiences, we do it all. Our Data Science team consists of ambitious, creative and passionate individuals, united in the common goal of making a difference. With millions of users generating hundreds of TBs of data daily, our day-to-day job becomes an adventure of connecting digital signals with real-life habits to formulate granular audience insights – who they are, how they behave, and ultimately, how we can expect them to behave in the future. The action does not stop there – we also take pride in working with the latest high-end hardware and world-class software architecture. This means there are virtually no limits to the scope of future events we can model, giving us insights on not just people, but also the entire inter-connected ecosystem to which they belong. We are perfectionists and we do not hide it. You will join a thrilling environment, implementing and deploying data science solutions that are both efficient and secure, setting the basis for a groundbreaking software platform for the long run.  YOUR ROLE AS DATA SCIENTIST As a Data Scientist, you will work end-to-end, leading entire projects and owning their outcomes through their entire lifecycle. You will formulate hypotheses on structured and unstructured data, design experiments, draw meaningful conclusions and effectively communicate the results to business stakeholders. You will be part of a relentless team, curious to extract the highest value possible in the most effective way. You will put into action your machine learning skills, and together, we will build optimum algorithms for regression, classification, clustering, and information extraction.","WHAT WE DO Niometrics captures, organises and extracts insights from some of the biggest and most complicated datasets that our modern societies currently produce. We put a magnifying glass on the realities collectively constructed by billions of connected individuals and machines, making sense of how humanity is re-creating wholly new digital universes with bits and bytes – universes that need to be seen, interpreted and explained. From taking deep dives into digital behaviours, to exploring the most intimate interactions between network technology and user experiences, we do it all. Our Data Science team consists of ambitious, creative and passionate individuals, united in the common goal of making a difference. With millions of users generating hundreds of TBs of data daily, our day-to-day job becomes an adventure of connecting digital signals with real-life habits to formulate granular audience insights – who they are, how they behave, and ultimately, how we can expect them to behave in the future. The action does not stop there – we also take pride in working with the latest high-end hardware and world-class software architecture. This means there are virtually no limits to the scope of future events we can model, giving us insights on not just people, but also the entire inter-connected ecosystem to which they belong. We are perfectionists and we do not hide it. You will join a thrilling environment, implementing and deploying data science solutions that are both efficient and secure, setting the basis for a groundbreaking software platform for the long run.  YOUR ROLE AS DATA SCIENTIST As a Data Scientist, you will work end-to-end, leading entire projects and owning their outcomes through their entire lifecycle. You will formulate hypotheses on structured and unstructured data, design experiments, draw meaningful conclusions and effectively communicate the results to business stakeholders. You will be part of a relentless team, curious to extract the highest value possible in the most effective way. You will put into action your machine learning skills, and together, we will build optimum algorithms for regression, classification, clustering, and information extraction."
Lead Data Scientist,REDMART LIMITED,"Permanent, Full Time",Professional,"Engineering, Information Technology",7000.0,14000.0,Monthly,"As one of the fastest growing e-commerce and logistics companies in Asia, RedMart is a part of Alibaba-backed Lazada, Southeast Asia’s leading online shopping and selling platform, and we offer an unparalleled scaling a startup experience. We’re focused on always improving our customer experience and achieving our mission: To save our customers time and money for the important things in life! We are looking for a Lead Data Scientist who cares deeply about customers and users to help develop the next generation of search and personalization at RedMart. You will build data mining systems to tackle hard problems in understanding and predicting consumer behavior to offer items to customers which are most relevant to them. You will work with engineers, product managers and designers to develop innovative new technologies and data driven features and products. You will also work closely with other Data Scientists to collaborate on projects and share techniques and learnings. If you enjoy working with data to build products and solve hard problems in surprisingly creative ways, this is the role for you.  ","As one of the fastest growing e-commerce and logistics companies in Asia, RedMart is a part of Alibaba-backed Lazada, Southeast Asia’s leading online shopping and selling platform, and we offer an unparalleled scaling a startup experience. We’re focused on always improving our customer experience and achieving our mission: To save our customers time and money for the important things in life! We are looking for a Lead Data Scientist who cares deeply about customers and users to help develop the next generation of search and personalization at RedMart. You will build data mining systems to tackle hard problems in understanding and predicting consumer behavior to offer items to customers which are most relevant to them. You will work with engineers, product managers and designers to develop innovative new technologies and data driven features and products. You will also work closely with other Data Scientists to collaborate on projects and share techniques and learnings. If you enjoy working with data to build products and solve hard problems in surprisingly creative ways, this is the role for you.  "
Senior Data Scientist,AMAZON WEB SERVICES SINGAPORE PRIVATE LIMITED,Permanent,Professional,Information Technology,250000.0,350000.0,Annually,"Excited by using massive amounts of data to develop Machine Learning (ML) and Deep Learning (DL) models? Want to help the largest global enterprises derive business value through the adoption of Artificial Intelligence (AI)? Eager to learn from many different enterprise’s use cases of AWS ML and DL? Thrilled to be key part of Amazon, who has been investing in Machine Learning for decades, pioneering and shaping the world’s AI technology? At Amazon Web Services (AWS), we are helping large enterprises build ML and DL models on the AWS Cloud. We are applying predictive technology to large volumes of data and against a wide spectrum of problems. Our Professional Services organization works together with our AWS customers to address their business needs using AI.   AWS Professional Services is a unique consulting team. We pride ourselves on being customer obsessed and highly focused on the AI enablement of our customers. If you have experience with AI, including building ML or DL models, we’d like to have you join our team. You will get to work with an innovative company, with great teammates, and have a lot of fun helping our customers.  A successful candidate will be a person who enjoys diving deep into data, doing analysis, discovering root causes, and designing long-term solutions. It will be a person who likes to have fun, loves to learn, and wants to innovate in the world of AI. Major responsibilities include:  Understand the customer’s business need and guide them to a solution using our AWS AI Services, AWS AI Platforms, AWS AI Frameworks, and AWS AI EC2 Instances . Assist customers by being able to deliver a ML / DL project from beginning to end, including understanding the business need, aggregating data, exploring data, building & validating predictive models, and deploying completed models to deliver business impact to the organization. Use Deep Learning frameworks like MXNet, Caffe 2, Tensorflow, Theano, CNTK, and Keras to help our customers build DL models. Use SparkML and Amazon Machine Learning (AML) to help our customers build ML models. Work with our Professional Services Big Data consultants to analyze, extract, normalize, and label relevant data. Work with our Professional Services DevOps consultants to help our customers operationalize models after they are built. Assist customers with identifying model drift and retraining models. Research and implement novel ML and DL approaches, including using FPGA. ","Excited by using massive amounts of data to develop Machine Learning (ML) and Deep Learning (DL) models? Want to help the largest global enterprises derive business value through the adoption of Artificial Intelligence (AI)? Eager to learn from many different enterprise’s use cases of AWS ML and DL? Thrilled to be key part of Amazon, who has been investing in Machine Learning for decades, pioneering and shaping the world’s AI technology? At Amazon Web Services (AWS), we are helping large enterprises build ML and DL models on the AWS Cloud. We are applying predictive technology to large volumes of data and against a wide spectrum of problems. Our Professional Services organization works together with our AWS customers to address their business needs using AI.   AWS Professional Services is a unique consulting team. We pride ourselves on being customer obsessed and highly focused on the AI enablement of our customers. If you have experience with AI, including building ML or DL models, we’d like to have you join our team. You will get to work with an innovative company, with great teammates, and have a lot of fun helping our customers.  A successful candidate will be a person who enjoys diving deep into data, doing analysis, discovering root causes, and designing long-term solutions. It will be a person who likes to have fun, loves to learn, and wants to innovate in the world of AI. Major responsibilities include:  Understand the customer’s business need and guide them to a solution using our AWS AI Services, AWS AI Platforms, AWS AI Frameworks, and AWS AI EC2 Instances . Assist customers by being able to deliver a ML / DL project from beginning to end, including understanding the business need, aggregating data, exploring data, building & validating predictive models, and deploying completed models to deliver business impact to the organization. Use Deep Learning frameworks like MXNet, Caffe 2, Tensorflow, Theano, CNTK, and Keras to help our customers build DL models. Use SparkML and Amazon Machine Learning (AML) to help our customers build ML models. Work with our Professional Services Big Data consultants to analyze, extract, normalize, and label relevant data. Work with our Professional Services DevOps consultants to help our customers operationalize models after they are built. Assist customers with identifying model drift and retraining models. Research and implement novel ML and DL approaches, including using FPGA. "
